{
  "schema_version": 1,
  "catalog_version": "2026.10.0",
  "component_id": "cmp_01j9zc3tk2m4p7q9r1sz",
  "revision": 1,
  "provenance": {
    "inputs": [
      {
        "spec_id": "ops_9f2e41a7c03b58d2a4c1f6b2e8d35790",
        "content_version": "ocv_f4a81c22d9075e3ba61c2ee98f83b405"
      }
    ],
    "execution_ref": null,
    "sources": [
      {
        "id": "src_oecd_dac",
        "name": "OECD DAC",
        "url": "https://stats.oecd.org/",
        "licence": "CC BY 4.0",
        "retrieved": "2026-06-12"
      }
    ],
    "freshness": {
      "data_through": "2024",
      "last_refreshed": "2026-06-12",
      "next_expected": "2026-10",
      "partial_period": false
    },
    "warnings": [],
    "generated_at": "2026-07-14T10:02:00Z",
    "citation": "OECD DAC (2026), via the Development Finance Observatory",
    "refreshed_from": null
  },
  "component": {
    "type": "stat_card",
    "title": {
      "text": "Malaria grants per person in Ethiopia",
      "authorship": "model"
    },
    "value": 3.34,
    "label": "Malaria grant disbursements to Ethiopia per person",
    "period": "2024",
    "unit": {
      "numerator": "US Dollar",
      "denominator": {
        "stat_var": "dcid:Count_Person",
        "label": "Total population"
      }
    }
  }
}
